id,title,skills,median_salary,growth_pct,education,sector,abilities,knowledge,work_activities,interests,job_zone
51-9082.00,Medical Appliance Technicians,"Active Listening, Critical Thinking, Quality Control Analysis, Reading Comprehension, Speaking, Troubleshooting, Social Perceptiveness",47060,3.7,bachelor,51,"Oral Comprehension, Problem Sensitivity, Near Vision, Oral Expression, Deductive Reasoning, Visualization, Arm-Hand Steadiness","Production and Processing, Customer and Personal Service, English Language, Mechanical, Design, Education and Training, Mathematics","Getting Information, Inspecting Equipment, Structures, or Materials, Making Decisions and Solving Problems, Communicating with Supervisors, Peers, or Subordinates, Organizing, Planning, and Prioritizing Work, Identifying Objects, Actions, and Events, Monitoring Processes, Materials, or Surroundings","Realistic, Investigative, Conventional, Social, Artistic, Enterprising",3
51-4122.00,"Welding, Soldering, and Brazing Machine Setters, Operators, and Tenders","Operations Monitoring, Active Listening, Speaking, Critical Thinking, Operation and Control, Monitoring, Complex Problem Solving",47060,-9.0,bachelor,51,"Control Precision, Near Vision, Manual Dexterity, Problem Sensitivity, Visualization, Oral Comprehension, Oral Expression","Mathematics, Mechanical, Education and Training, Production and Processing, Design, English Language, Administration and Management","Handling and Moving Objects, Performing General Physical Activities, Getting Information, Inspecting Equipment, Structures, or Materials, Controlling Machines and Processes, Processing Information, Communicating with Supervisors, Peers, or Subordinates","Realistic, Conventional, Investigative, Enterprising, Artistic, Social",2
51-9051.00,"Furnace, Kiln, Oven, Drier, and Kettle Operators and Tenders","Operations Monitoring, Reading Comprehension, Active Listening, Speaking, Critical Thinking, Monitoring, Operation and Control",47010,3.0,bachelor,51,"Problem Sensitivity, Control Precision, Oral Comprehension, Written Comprehension, Arm-Hand Steadiness, Near Vision, Speech Recognition","Mechanical, Production and Processing, Public Safety and Security, Computers and Electronics, English Language, Education and Training, Mathematics","Controlling Machines and Processes, Inspecting Equipment, Structures, or Materials, Identifying Objects, Actions, and Events, Handling and Moving Objects, Monitoring Processes, Materials, or Surroundings, Getting Information, Making Decisions and Solving Problems","Realistic, Conventional, Investigative, Social, Enterprising, Artistic",2
51-4021.00,"Extruding and Drawing Machine Setters, Operators, and Tenders, Metal and Plastic","Operations Monitoring, Operation and Control, Critical Thinking, Monitoring, Quality Control Analysis, Judgment and Decision Making, Speaking",46980,1.2,bachelor,51,"Control Precision, Manual Dexterity, Multilimb Coordination, Reaction Time, Problem Sensitivity, Rate Control, Near Vision","Production and Processing, Mathematics, English Language, Administration and Management, Computers and Electronics, Mechanical, Public Safety and Security","Controlling Machines and Processes, Making Decisions and Solving Problems, Getting Information, Communicating with Supervisors, Peers, or Subordinates, Inspecting Equipment, Structures, or Materials, Performing General Physical Activities, Monitoring Processes, Materials, or Surroundings","Realistic, Conventional, Investigative, Artistic, Social, Enterprising",2
47-4031.00,Fence Erectors,"Active Listening, Speaking, Critical Thinking, Monitoring, Coordination, Time Management, Operations Monitoring",46940,4.6,bachelor,47,"Manual Dexterity, Trunk Strength, Multilimb Coordination, Static Strength, Arm-Hand Steadiness, Finger Dexterity, Information Ordering","Customer and Personal Service, Building and Construction, Transportation, Administration and Management, Design, Mathematics, English Language","Controlling Machines and Processes, Performing General Physical Activities, Getting Information, Handling and Moving Objects, Communicating with Supervisors, Peers, or Subordinates, Operating Vehicles, Mechanized Devices, or Equipment, Organizing, Planning, and Prioritizing Work","Realistic, Conventional, Investigative, Artistic, Social, Enterprising",2
51-9021.00,"Crushing, Grinding, and Polishing Machine Setters, Operators, and Tenders","Operations Monitoring, Operation and Control, Monitoring, Reading Comprehension, Active Listening, Speaking, Instructing",46890,-2.5,bachelor,51,"Multilimb Coordination, Arm-Hand Steadiness, Manual Dexterity, Control Precision, Rate Control, Reaction Time, Near Vision","Production and Processing, Mechanical, English Language, Public Safety and Security, Mathematics, Education and Training, Food Production","Controlling Machines and Processes, Communicating with Supervisors, Peers, or Subordinates, Handling and Moving Objects, Monitoring Processes, Materials, or Surroundings, Performing General Physical Activities, Identifying Objects, Actions, and Events, Getting Information","Realistic, Conventional, Investigative, Enterprising, Artistic, Social",2
49-2011.00,"Computer, Automated Teller, and Office Machine Repairers","Active Listening, Repairing, Critical Thinking, Complex Problem Solving, Troubleshooting, Speaking, Equipment Selection",46860,-0.9,bachelor,49,"Near Vision, Oral Comprehension, Oral Expression, Problem Sensitivity, Written Comprehension, Finger Dexterity, Speech Recognition","Computers and Electronics, Customer and Personal Service, Mechanical, Engineering and Technology, English Language, Education and Training, Transportation","Repairing and Maintaining Electronic Equipment, Making Decisions and Solving Problems, Communicating with People Outside the Organization, Working with Computers, Inspecting Equipment, Structures, or Materials, Getting Information, Repairing and Maintaining Mechanical Equipment","Realistic, Conventional, Investigative, Social, Enterprising, Artistic",3
19-4012.00,Agricultural Technicians,"Reading Comprehension, Active Listening, Writing, Critical Thinking, Complex Problem Solving, Mathematics, Monitoring",46790,4.3,bachelor,19,"Written Comprehension, Near Vision, Oral Comprehension, Oral Expression, Problem Sensitivity, Written Expression, Information Ordering","Mathematics, Biology, Chemistry, Administration and Management, English Language, Administrative, Computers and Electronics","Documenting/Recording Information, Getting Information, Communicating with Supervisors, Peers, or Subordinates, Monitoring Processes, Materials, or Surroundings, Processing Information, Identifying Objects, Actions, and Events, Updating and Using Relevant Knowledge","Realistic, Investigative, Conventional, Enterprising, Social, Artistic",3
43-4021.00,Correspondence Clerks,"Writing, Reading Comprehension, Active Listening, Speaking, Critical Thinking, Judgment and Decision Making, Social Perceptiveness",46740,-5.6,bachelor,43,"Written Expression, Written Comprehension, Oral Comprehension, Oral Expression, Near Vision, Problem Sensitivity, Speech Clarity","Administrative, English Language, Customer and Personal Service, Economics and Accounting, Mathematics, Computers and Electronics, Administration and Management","Working with Computers, Communicating with Supervisors, Peers, or Subordinates, Getting Information, Performing Administrative Activities, Organizing, Planning, and Prioritizing Work, Documenting/Recording Information, Processing Information","Conventional, Enterprising, Social, Investigative, Artistic, Realistic",2
47-2061.00,Construction Laborers,"Speaking, Active Listening, Coordination, Operation and Control, Operations Monitoring, Reading Comprehension, Critical Thinking",46730,7.3,bachelor,47,"Manual Dexterity, Static Strength, Multilimb Coordination, Arm-Hand Steadiness, Oral Comprehension, Oral Expression, Problem Sensitivity","Building and Construction, Public Safety and Security, Mechanical, Customer and Personal Service, Education and Training, Administration and Management, Design","Inspecting Equipment, Structures, or Materials, Getting Information, Monitoring Processes, Materials, or Surroundings, Controlling Machines and Processes, Identifying Objects, Actions, and Events, Making Decisions and Solving Problems, Organizing, Planning, and Prioritizing Work","Realistic, Conventional, Investigative, Artistic, Enterprising, Social",2
45-4023.00,Log Graders and Scalers,"Active Listening, Critical Thinking, Speaking, Writing, Active Learning, Monitoring, Coordination",46710,-0.7,bachelor,45,"Near Vision, Problem Sensitivity, Oral Comprehension, Oral Expression, Deductive Reasoning, Inductive Reasoning, Category Flexibility","Production and Processing, Mathematics, Customer and Personal Service, Administration and Management, Mechanical, Education and Training, Transportation","Judging the Qualities of Objects, Services, or People, Documenting/Recording Information, Estimating the Quantifiable Characteristics of Products, Events, or Information, Inspecting Equipment, Structures, or Materials, Evaluating Information to Determine Compliance with Standards, Communicating with Supervisors, Peers, or Subordinates, Getting Information","Conventional, Realistic, Investigative, Enterprising, Social, Artistic",2
51-4032.00,"Drilling and Boring Machine Tool Setters, Operators, and Tenders, Metal and Plastic","Operations Monitoring, Reading Comprehension, Monitoring, Operation and Control, Active Listening, Speaking, Critical Thinking",46630,-19.6,bachelor,51,"Control Precision, Arm-Hand Steadiness, Near Vision, Problem Sensitivity, Information Ordering, Selective Attention, Manual Dexterity","Mathematics, Production and Processing, Mechanical, English Language, Engineering and Technology, Education and Training, Design","Controlling Machines and Processes, Getting Information, Communicating with Supervisors, Peers, or Subordinates, Inspecting Equipment, Structures, or Materials, Making Decisions and Solving Problems, Handling and Moving Objects, Documenting/Recording Information","Realistic, Conventional, Investigative, Artistic, Social, Enterprising",2
43-4141.00,New Accounts Clerks,"Active Listening, Speaking, Reading Comprehension, Service Orientation, Social Perceptiveness, Critical Thinking, Monitoring",46610,-13.2,bachelor,43,"Oral Comprehension, Oral Expression, Written Comprehension, Near Vision, Speech Recognition, Speech Clarity, Deductive Reasoning","Customer and Personal Service, Sales and Marketing, Administrative, English Language, Computers and Electronics, Mathematics, Economics and Accounting","Getting Information, Communicating with Supervisors, Peers, or Subordinates, Establishing and Maintaining Interpersonal Relationships, Evaluating Information to Determine Compliance with Standards, Making Decisions and Solving Problems, Performing for or Working Directly with the Public, Resolving Conflicts and Negotiating with Others","Conventional, Enterprising, Social, Investigative, Realistic, Artistic",3
29-2081.00,"Opticians, Dispensing","Speaking, Active Listening, Reading Comprehension, Critical Thinking, Service Orientation, Writing, Social Perceptiveness",46560,2.9,bachelor,29,"Oral Comprehension, Oral Expression, Near Vision, Written Comprehension, Speech Recognition, Speech Clarity, Written Expression","Customer and Personal Service, Sales and Marketing, Mathematics, Production and Processing, Administrative, English Language, Administration and Management","Performing for or Working Directly with the Public, Documenting/Recording Information, Selling or Influencing Others, Getting Information, Evaluating Information to Determine Compliance with Standards, Making Decisions and Solving Problems, Updating and Using Relevant Knowledge","Conventional, Realistic, Enterprising, Social, Investigative, Artistic",3
49-3053.00,Outdoor Power Equipment and Other Small Engine Mechanics,"Equipment Maintenance, Repairing, Troubleshooting, Operations Monitoring, Critical Thinking, Equipment Selection, Operation and Control",46560,2.5,bachelor,49,"Finger Dexterity, Arm-Hand Steadiness, Manual Dexterity, Near Vision, Control Precision, Visualization, Problem Sensitivity","Mechanical, Customer and Personal Service, English Language, Engineering and Technology, Education and Training, Transportation, Sales and Marketing","Repairing and Maintaining Mechanical Equipment, Updating and Using Relevant Knowledge, Making Decisions and Solving Problems, Inspecting Equipment, Structures, or Materials, Identifying Objects, Actions, and Events, Handling and Moving Objects, Getting Information","Realistic, Conventional, Investigative, Enterprising, Social, Artistic",2
31-9093.00,Medical Equipment Preparers,"Critical Thinking, Monitoring, Quality Control Analysis, Active Listening, Operations Monitoring, Reading Comprehension, Speaking",46490,10.0,bachelor,31,"Near Vision, Problem Sensitivity, Oral Comprehension, Oral Expression, Written Expression, Deductive Reasoning, Information Ordering","Customer and Personal Service, English Language, Biology, Production and Processing, Public Safety and Security, Administrative, Chemistry","Evaluating Information to Determine Compliance with Standards, Documenting/Recording Information, Monitoring Processes, Materials, or Surroundings, Processing Information, Organizing, Planning, and Prioritizing Work, Inspecting Equipment, Structures, or Materials, Getting Information","Realistic, Conventional, Investigative, Social, Artistic, Enterprising",2
47-3011.00,"Helpers--Brickmasons, Blockmasons, Stonemasons, and Tile and Marble Setters","Critical Thinking, Monitoring, Coordination, Operation and Control, Time Management, Active Listening, Judgment and Decision Making",46480,-10.5,bachelor,47,"Trunk Strength, Multilimb Coordination, Static Strength, Arm-Hand Steadiness, Near Vision, Manual Dexterity, Extent Flexibility","Building and Construction, Mechanical, Design, Mathematics, English Language, Public Safety and Security, Production and Processing","Handling and Moving Objects, Getting Information, Inspecting Equipment, Structures, or Materials, Making Decisions and Solving Problems, Performing General Physical Activities, Identifying Objects, Actions, and Events, Monitoring Processes, Materials, or Surroundings","Realistic, Conventional, Social, Artistic, Investigative, Enterprising",2
53-7051.00,Industrial Truck and Tractor Operators,"Operation and Control, Operations Monitoring, Coordination, Equipment Maintenance, Troubleshooting, Time Management, Reading Comprehension",46390,1.1,bachelor,53,"Control Precision, Multilimb Coordination, Far Vision, Response Orientation, Manual Dexterity, Rate Control, Problem Sensitivity","Mathematics, English Language, Production and Processing, Transportation, Customer and Personal Service, Administration and Management, Administrative","Operating Vehicles, Mechanized Devices, or Equipment, Inspecting Equipment, Structures, or Materials, Handling and Moving Objects, Identifying Objects, Actions, and Events, Performing General Physical Activities, Making Decisions and Solving Problems, Organizing, Planning, and Prioritizing Work","Realistic, Conventional, Investigative, Enterprising, Social, Artistic",2
43-6014.00,"Secretaries and Administrative Assistants, Except Legal, Medical, and Executive","Active Listening, Speaking, Reading Comprehension, Writing, Service Orientation, Time Management, Monitoring",46290,-1.6,bachelor,43,"Oral Comprehension, Written Comprehension, Oral Expression, Written Expression, Near Vision, Speech Recognition, Speech Clarity","Administrative, English Language, Computers and Electronics, Customer and Personal Service, Administration and Management, Mathematics, Communications and Media","Working with Computers, Communicating with Supervisors, Peers, or Subordinates, Getting Information, Performing Administrative Activities, Organizing, Planning, and Prioritizing Work, Establishing and Maintaining Interpersonal Relationships, Documenting/Recording Information","Conventional, Enterprising, Social, Realistic, Investigative, Artistic",2
51-6093.00,Upholsterers,"Critical Thinking, Reading Comprehension, Active Listening, Speaking, Active Learning, Monitoring, Complex Problem Solving",46190,-1.8,bachelor,51,"Arm-Hand Steadiness, Manual Dexterity, Finger Dexterity, Near Vision, Control Precision, Multilimb Coordination, Visual Color Discrimination","Production and Processing, Design, Customer and Personal Service, Mechanical, Education and Training, Mathematics, Building and Construction","Handling and Moving Objects, Inspecting Equipment, Structures, or Materials, Getting Information, Performing General Physical Activities, Estimating the Quantifiable Characteristics of Products, Events, or Information, Making Decisions and Solving Problems, Judging the Qualities of Objects, Services, or People","Realistic, Artistic, Conventional, Investigative, Social, Enterprising",2
39-9031.00,Exercise Trainers and Group Fitness Instructors,"Instructing, Service Orientation, Speaking, Active Listening, Learning Strategies, Monitoring, Social Perceptiveness",46180,11.9,bachelor,39,"Extent Flexibility, Oral Expression, Stamina, Gross Body Coordination, Speech Clarity, Trunk Strength, Static Strength","Customer and Personal Service, English Language, Education and Training, Psychology, Sales and Marketing, Medicine and Dentistry, Biology","Performing General Physical Activities, Establishing and Maintaining Interpersonal Relationships, Performing for or Working Directly with the Public, Training and Teaching Others, Coaching and Developing Others, Assisting and Caring for Others, Getting Information","Social, Realistic, Enterprising, Investigative, Conventional, Artistic",3
21-1015.00,Rehabilitation Counselors,"Active Listening, Speaking, Social Perceptiveness, Service Orientation, Monitoring, Reading Comprehension, Writing",46110,1.4,bachelor,21,"Oral Comprehension, Oral Expression, Speech Clarity, Written Comprehension, Written Expression, Problem Sensitivity, Deductive Reasoning","Customer and Personal Service, Therapy and Counseling, Psychology, Education and Training, English Language, Administrative, Computers and Electronics","Communicating with Supervisors, Peers, or Subordinates, Making Decisions and Solving Problems, Establishing and Maintaining Interpersonal Relationships, Documenting/Recording Information, Communicating with People Outside the Organization, Getting Information, Working with Computers","Social, Enterprising, Investigative, Conventional, Artistic, Realistic",4
51-4081.00,"Multiple Machine Tool Setters, Operators, and Tenders, Metal and Plastic","Operations Monitoring, Quality Control Analysis, Monitoring, Operation and Control, Equipment Maintenance, Judgment and Decision Making, Reading Comprehension",46060,-0.5,bachelor,51,"Arm-Hand Steadiness, Control Precision, Near Vision, Manual Dexterity, Problem Sensitivity, Visualization, Information Ordering","Production and Processing, Mechanical, Mathematics, English Language, Design, Education and Training, Customer and Personal Service","Getting Information, Identifying Objects, Actions, and Events, Controlling Machines and Processes, Inspecting Equipment, Structures, or Materials, Evaluating Information to Determine Compliance with Standards, Making Decisions and Solving Problems, Monitoring Processes, Materials, or Surroundings","Realistic, Conventional, Investigative, Social, Artistic, Enterprising",2
43-3011.00,Bill and Account Collectors,"Active Listening, Speaking, Social Perceptiveness, Persuasion, Writing, Reading Comprehension, Critical Thinking",46040,-10.5,bachelor,43,"Oral Comprehension, Oral Expression, Written Comprehension, Speech Recognition, Speech Clarity, Written Expression, Near Vision","English Language, Customer and Personal Service, Mathematics, Economics and Accounting, Law and Government, Computers and Electronics, Administration and Management","Working with Computers, Organizing, Planning, and Prioritizing Work, Documenting/Recording Information, Communicating with Supervisors, Peers, or Subordinates, Resolving Conflicts and Negotiating with Others, Getting Information, Establishing and Maintaining Interpersonal Relationships","Conventional, Enterprising, Social, Realistic, Investigative, Artistic",2
51-7011.00,Cabinetmakers and Bench Carpenters,"Operations Monitoring, Quality Control Analysis, Monitoring, Operation and Control, Speaking, Critical Thinking, Operations Analysis",46020,-1.6,bachelor,51,"Arm-Hand Steadiness, Manual Dexterity, Finger Dexterity, Near Vision, Control Precision, Multilimb Coordination, Trunk Strength","Mathematics, Building and Construction, Production and Processing, Mechanical, Design, Engineering and Technology, Education and Training","Getting Information, Handling and Moving Objects, Controlling Machines and Processes, Performing General Physical Activities, Making Decisions and Solving Problems, Estimating the Quantifiable Characteristics of Products, Events, or Information, Inspecting Equipment, Structures, or Materials","Realistic, Conventional, Artistic, Investigative, Enterprising, Social",2
29-2056.00,Veterinary Technologists and Technicians,"Active Listening, Critical Thinking, Reading Comprehension, Speaking, Writing, Monitoring, Complex Problem Solving",45980,9.1,bachelor,29,"Oral Expression, Deductive Reasoning, Inductive Reasoning, Near Vision, Oral Comprehension, Written Comprehension, Problem Sensitivity","Medicine and Dentistry, Customer and Personal Service, Biology, English Language, Mathematics, Chemistry, Computers and Electronics","Identifying Objects, Actions, and Events, Assisting and Caring for Others, Documenting/Recording Information, Getting Information, Inspecting Equipment, Structures, or Materials, Performing General Physical Activities, Monitoring Processes, Materials, or Surroundings","Realistic, Investigative, Conventional, Social, Artistic, Enterprising",3
27-2022.00,Coaches and Scouts,"Instructing, Speaking, Learning Strategies, Monitoring, Reading Comprehension, Active Listening, Critical Thinking",45920,6.4,bachelor,27,"Oral Expression, Oral Comprehension, Speech Recognition, Speech Clarity, Originality, Information Ordering, Written Comprehension","Education and Training, English Language, Administration and Management, Psychology, Customer and Personal Service, Communications and Media, Personnel and Human Resources","Establishing and Maintaining Interpersonal Relationships, Making Decisions and Solving Problems, Coaching and Developing Others, Organizing, Planning, and Prioritizing Work, Developing and Building Teams, Getting Information, Judging the Qualities of Objects, Services, or People","Social, Enterprising, Realistic, Conventional, Artistic, Investigative",4
33-9011.00,Animal Control Workers,"Active Listening, Speaking, Critical Thinking, Reading Comprehension, Social Perceptiveness, Service Orientation, Writing",45830,3.9,bachelor,33,"Oral Comprehension, Oral Expression, Problem Sensitivity, Deductive Reasoning, Written Comprehension, Inductive Reasoning, Speech Clarity","Customer and Personal Service, Law and Government, Public Safety and Security, English Language, Administrative, Administration and Management, Psychology","Performing for or Working Directly with the Public, Documenting/Recording Information, Making Decisions and Solving Problems, Evaluating Information to Determine Compliance with Standards, Getting Information, Operating Vehicles, Mechanized Devices, or Equipment, Resolving Conflicts and Negotiating with Others","Realistic, Conventional, Investigative, Social, Enterprising, Artistic",2
51-2051.00,Fiberglass Laminators and Fabricators,"Monitoring, Operations Monitoring, Reading Comprehension, Active Listening, Speaking, Complex Problem Solving, Writing",45760,4.2,bachelor,51,"Problem Sensitivity, Arm-Hand Steadiness, Multilimb Coordination, Trunk Strength, Near Vision, Oral Comprehension, Information Ordering","Administration and Management, Production and Processing, Education and Training, Chemistry, English Language, Customer and Personal Service, Building and Construction","Inspecting Equipment, Structures, or Materials, Getting Information, Making Decisions and Solving Problems, Identifying Objects, Actions, and Events, Monitoring Processes, Materials, or Surroundings, Controlling Machines and Processes, Judging the Qualities of Objects, Services, or People","Realistic, Conventional, Artistic, Investigative, Enterprising, Social",2
51-9032.00,"Cutting and Slicing Machine Setters, Operators, and Tenders","Operations Monitoring, Operation and Control, Quality Control Analysis, Monitoring, Reading Comprehension, Critical Thinking, Coordination",45700,-2.3,bachelor,51,"Finger Dexterity, Control Precision, Near Vision, Arm-Hand Steadiness, Problem Sensitivity, Manual Dexterity, Oral Comprehension","Production and Processing, Mathematics, Mechanical, English Language, Administration and Management, Education and Training, Customer and Personal Service","Controlling Machines and Processes, Handling and Moving Objects, Monitoring Processes, Materials, or Surroundings, Performing General Physical Activities, Inspecting Equipment, Structures, or Materials, Communicating with Supervisors, Peers, or Subordinates, Getting Information","Realistic, Conventional, Investigative, Enterprising, Artistic, Social",2
