id,title,skills,median_salary,growth_pct,education,sector,abilities,knowledge,work_activities,interests,job_zone
19-1011.00,Animal Scientists,"Reading Comprehension, Writing, Science, Critical Thinking, Complex Problem Solving, Judgment and Decision Making, Active Listening",79120,5.8,bachelor,19,"Oral Comprehension, Written Comprehension, Oral Expression, Written Expression, Problem Sensitivity, Deductive Reasoning, Inductive Reasoning","Biology, Mathematics, English Language, Chemistry, Food Production, Education and Training, Customer and Personal Service","Analyzing Data or Information, Working with Computers, Getting Information, Making Decisions and Solving Problems, Processing Information, Updating and Using Relevant Knowledge, Interpreting the Meaning of Information for Others","Investigative, Realistic, Conventional, Enterprising, Social, Artistic",5
29-1011.00,Chiropractors,"Active Listening, Reading Comprehension, Speaking, Critical Thinking, Writing, Social Perceptiveness, Complex Problem Solving",79000,9.5,bachelor,29,"Oral Comprehension, Written Comprehension, Oral Expression, Problem Sensitivity, Deductive Reasoning, Inductive Reasoning, Written Expression","Medicine and Dentistry, English Language, Customer and Personal Service, Biology, Psychology, Administration and Management, Administrative","Assisting and Caring for Others, Documenting/Recording Information, Making Decisions and Solving Problems, Getting Information, Updating and Using Relevant Knowledge, Identifying Objects, Actions, and Events, Performing General Physical Activities","Social, Realistic, Investigative, Conventional, Enterprising, Artistic",5
47-1011.00,First-Line Supervisors of Construction Trades and Extraction Workers,"Coordination, Active Listening, Speaking, Critical Thinking, Management of Personnel Resources, Reading Comprehension, Monitoring",78690,5.3,bachelor,47,"Oral Comprehension, Oral Expression, Problem Sensitivity, Information Ordering, Near Vision, Deductive Reasoning, Written Comprehension","Administration and Management, Building and Construction, Mechanical, Customer and Personal Service, English Language, Design, Public Safety and Security","Communicating with Supervisors, Peers, or Subordinates, Making Decisions and Solving Problems, Inspecting Equipment, Structures, or Materials, Getting Information, Coordinating the Work and Activities of Others, Organizing, Planning, and Prioritizing Work, Scheduling Work and Activities","Enterprising, Conventional, Realistic, Social, Investigative, Artistic",3
49-3011.00,Aircraft Mechanics and Service Technicians,"Equipment Maintenance, Repairing, Operations Monitoring, Troubleshooting, Critical Thinking, Complex Problem Solving, Quality Control Analysis",78680,4.0,bachelor,49,"Written Comprehension, Problem Sensitivity, Information Ordering, Finger Dexterity, Control Precision, Arm-Hand Steadiness, Manual Dexterity","Mechanical, English Language, Engineering and Technology, Customer and Personal Service, Mathematics, Public Safety and Security, Transportation","Getting Information, Documenting/Recording Information, Inspecting Equipment, Structures, or Materials, Evaluating Information to Determine Compliance with Standards, Repairing and Maintaining Mechanical Equipment, Identifying Objects, Actions, and Events, Monitoring Processes, Materials, or Surroundings","Realistic, Conventional, Investigative, Enterprising, Social, Artistic",3
25-1082.00,"Library Science Teachers, Postsecondary","Instructing, Reading Comprehension, Speaking, Active Listening, Writing, Critical Thinking, Active Learning",78630,3.0,bachelor,25,"Oral Comprehension, Written Comprehension, Oral Expression, Written Expression, Speech Clarity, Deductive Reasoning, Inductive Reasoning","English Language, Education and Training, Computers and Electronics, Customer and Personal Service, Communications and Media, Sociology and Anthropology, Psychology","Getting Information, Working with Computers, Training and Teaching Others, Interpreting the Meaning of Information for Others, Updating and Using Relevant Knowledge, Analyzing Data or Information, Thinking Creatively","Social, Investigative, Conventional, Artistic, Realistic, Enterprising",5
13-1041.00,Compliance Officers,"Active Listening, Reading Comprehension, Speaking, Critical Thinking, Social Perceptiveness, Judgment and Decision Making, Writing",78420,3.0,bachelor,13,"Oral Comprehension, Written Comprehension, Oral Expression, Speech Clarity, Inductive Reasoning, Near Vision, Speech Recognition","Law and Government, English Language, Customer and Personal Service, Public Safety and Security, Computers and Electronics, Administration and Management, Administrative","Getting Information, Evaluating Information to Determine Compliance with Standards, Documenting/Recording Information, Processing Information, Communicating with People Outside the Organization, Performing for or Working Directly with the Public, Communicating with Supervisors, Peers, or Subordinates","Conventional, Enterprising, Investigative, Social, Realistic, Artistic",3
17-1021.00,Cartographers and Photogrammetrists,"Reading Comprehension, Writing, Critical Thinking, Active Listening, Active Learning, Speaking, Monitoring",78380,6.4,bachelor,17,"Written Comprehension, Oral Comprehension, Near Vision, Inductive Reasoning, Oral Expression, Written Expression, Deductive Reasoning","Geography, Computers and Electronics, English Language, Design, Mathematics, Customer and Personal Service, Engineering and Technology","Getting Information, Working with Computers, Evaluating Information to Determine Compliance with Standards, Making Decisions and Solving Problems, Updating and Using Relevant Knowledge, Identifying Objects, Actions, and Events, Documenting/Recording Information","Conventional, Investigative, Realistic, Artistic, Social, Enterprising",4
29-2091.00,Orthotists and Prosthetists,"Reading Comprehension, Active Listening, Writing, Speaking, Critical Thinking, Service Orientation, Complex Problem Solving",78310,13.3,bachelor,29,"Written Comprehension, Oral Comprehension, Oral Expression, Written Expression, Problem Sensitivity, Inductive Reasoning, Near Vision","Customer and Personal Service, Design, Production and Processing, English Language, Administration and Management, Mechanical, Psychology","Documenting/Recording Information, Assisting and Caring for Others, Getting Information, Making Decisions and Solving Problems, Establishing and Maintaining Interpersonal Relationships, Processing Information, Updating and Using Relevant Knowledge","Realistic, Investigative, Social, Conventional, Artistic, Enterprising",5
49-1011.00,"First-Line Supervisors of Mechanics, Installers, and Repairers","Monitoring, Management of Personnel Resources, Speaking, Critical Thinking, Coordination, Judgment and Decision Making, Time Management",78300,3.1,bachelor,49,"Oral Comprehension, Written Comprehension, Oral Expression, Deductive Reasoning, Inductive Reasoning, Near Vision, Problem Sensitivity","Administration and Management, Mechanical, Customer and Personal Service, Administrative, Personnel and Human Resources, English Language, Mathematics","Making Decisions and Solving Problems, Monitoring Processes, Materials, or Surroundings, Organizing, Planning, and Prioritizing Work, Getting Information, Evaluating Information to Determine Compliance with Standards, Communicating with Supervisors, Peers, or Subordinates, Operating Vehicles, Mechanized Devices, or Equipment","Enterprising, Conventional, Realistic, Social, Investigative, Artistic",3
25-1123.00,"English Language and Literature Teachers, Postsecondary","Reading Comprehension, Instructing, Writing, Speaking, Active Listening, Learning Strategies, Active Learning",78270,0.0,bachelor,25,"Written Comprehension, Oral Expression, Oral Comprehension, Written Expression, Speech Clarity, Deductive Reasoning, Inductive Reasoning","English Language, Education and Training, Communications and Media, History and Archeology, Philosophy and Theology, Sociology and Anthropology, Customer and Personal Service","Training and Teaching Others, Establishing and Maintaining Interpersonal Relationships, Interpreting the Meaning of Information for Others, Communicating with Supervisors, Peers, or Subordinates, Thinking Creatively, Making Decisions and Solving Problems, Organizing, Planning, and Prioritizing Work","Social, Investigative, Artistic, Conventional, Enterprising, Realistic",5
11-9151.00,Social and Community Service Managers,"Social Perceptiveness, Service Orientation, Active Listening, Critical Thinking, Active Learning, Monitoring, Coordination",78240,6.4,bachelor,11,"Oral Expression, Oral Comprehension, Written Comprehension, Problem Sensitivity, Written Expression, Deductive Reasoning, Speech Recognition","Customer and Personal Service, Administration and Management, English Language, Psychology, Education and Training, Personnel and Human Resources, Therapy and Counseling","Communicating with Supervisors, Peers, or Subordinates, Getting Information, Organizing, Planning, and Prioritizing Work, Working with Computers, Updating and Using Relevant Knowledge, Performing Administrative Activities, Establishing and Maintaining Interpersonal Relationships","Enterprising, Social, Conventional, Artistic, Investigative, Realistic",4
29-1291.00,Acupuncturists,"Active Listening, Critical Thinking, Social Perceptiveness, Service Orientation, Speaking, Judgment and Decision Making, Reading Comprehension",78140,6.8,bachelor,29,"Oral Comprehension, Oral Expression, Problem Sensitivity, Deductive Reasoning, Inductive Reasoning, Near Vision, Written Comprehension","Medicine and Dentistry, Customer and Personal Service, Therapy and Counseling, Psychology, Sales and Marketing, Education and Training, English Language","Assisting and Caring for Others, Updating and Using Relevant Knowledge, Establishing and Maintaining Interpersonal Relationships, Making Decisions and Solving Problems, Documenting/Recording Information, Getting Information, Judging the Qualities of Objects, Services, or People","Social, Investigative, Realistic, Conventional, Artistic, Enterprising",5
41-3031.00,"Securities, Commodities, and Financial Services Sales Agents","Active Listening, Critical Thinking, Monitoring, Judgment and Decision Making, Reading Comprehension, Speaking, Active Learning",78140,3.3,bachelor,41,"Oral Comprehension, Oral Expression, Deductive Reasoning, Written Comprehension, Speech Clarity, Written Expression, Problem Sensitivity","Customer and Personal Service, Economics and Accounting, English Language, Mathematics, Sales and Marketing, Computers and Electronics, Administration and Management","Working with Computers, Getting Information, Establishing and Maintaining Interpersonal Relationships, Processing Information, Making Decisions and Solving Problems, Updating and Using Relevant Knowledge, Communicating with People Outside the Organization","Enterprising, Conventional, Social, Investigative, Artistic, Realistic",4
33-2021.00,Fire Inspectors and Investigators,"Active Listening, Writing, Speaking, Critical Thinking, Reading Comprehension, Social Perceptiveness, Monitoring",78060,3.8,bachelor,33,"Problem Sensitivity, Oral Comprehension, Written Comprehension, Written Expression, Oral Expression, Deductive Reasoning, Inductive Reasoning","Public Safety and Security, Customer and Personal Service, Building and Construction, Law and Government, Education and Training, English Language, Administration and Management","Evaluating Information to Determine Compliance with Standards, Performing for or Working Directly with the Public, Documenting/Recording Information, Updating and Using Relevant Knowledge, Communicating with People Outside the Organization, Getting Information, Inspecting Equipment, Structures, or Materials","Realistic, Conventional, Investigative, Enterprising, Social, Artistic",3
25-1126.00,"Philosophy and Religion Teachers, Postsecondary","Reading Comprehension, Active Listening, Speaking, Instructing, Writing, Critical Thinking, Learning Strategies",78050,0.7,bachelor,25,"Written Comprehension, Oral Expression, Speech Clarity, Oral Comprehension, Written Expression, Inductive Reasoning, Deductive Reasoning","Philosophy and Theology, English Language, Education and Training, History and Archeology, Sociology and Anthropology, Law and Government, Computers and Electronics","Training and Teaching Others, Interpreting the Meaning of Information for Others, Getting Information, Thinking Creatively, Making Decisions and Solving Problems, Working with Computers, Updating and Using Relevant Knowledge","Social, Investigative, Artistic, Conventional, Enterprising, Realistic",5
25-1122.00,"Communications Teachers, Postsecondary","Reading Comprehension, Active Listening, Speaking, Instructing, Writing, Active Learning, Learning Strategies",77800,2.1,bachelor,25,"Oral Comprehension, Oral Expression, Speech Clarity, Written Comprehension, Written Expression, Deductive Reasoning, Inductive Reasoning","English Language, Education and Training, Communications and Media, Psychology, Computers and Electronics, Sociology and Anthropology, Customer and Personal Service","Documenting/Recording Information, Thinking Creatively, Working with Computers, Making Decisions and Solving Problems, Training and Teaching Others, Identifying Objects, Actions, and Events, Updating and Using Relevant Knowledge","Social, Investigative, Artistic, Conventional, Enterprising, Realistic",5
29-2034.00,Radiologic Technologists and Technicians,"Active Listening, Social Perceptiveness, Reading Comprehension, Speaking, Service Orientation, Monitoring, Critical Thinking",77660,4.3,bachelor,29,"Oral Comprehension, Problem Sensitivity, Near Vision, Oral Expression, Written Comprehension, Deductive Reasoning, Information Ordering","Medicine and Dentistry, Customer and Personal Service, English Language, Computers and Electronics, Administrative, Education and Training, Public Safety and Security","Assisting and Caring for Others, Working with Computers, Updating and Using Relevant Knowledge, Documenting/Recording Information, Controlling Machines and Processes, Handling and Moving Objects, Performing for or Working Directly with the Public","Realistic, Conventional, Investigative, Social, Artistic, Enterprising",3
53-4011.00,Locomotive Engineers,"Operation and Control, Operations Monitoring, Active Listening, Speaking, Critical Thinking, Monitoring, Reading Comprehension",77400,0.7,bachelor,53,"Far Vision, Selective Attention, Control Precision, Response Orientation, Problem Sensitivity, Reaction Time, Near Vision","Transportation, Public Safety and Security, English Language, Education and Training, Customer and Personal Service, Mechanical, Administration and Management","Controlling Machines and Processes, Identifying Objects, Actions, and Events, Inspecting Equipment, Structures, or Materials, Operating Vehicles, Mechanized Devices, or Equipment, Getting Information, Evaluating Information to Determine Compliance with Standards, Monitoring Processes, Materials, or Surroundings","Realistic, Conventional, Investigative, Enterprising, Social, Artistic",2
25-1192.00,"Family and Consumer Sciences Teachers, Postsecondary","Speaking, Reading Comprehension, Active Listening, Learning Strategies, Instructing, Critical Thinking, Writing",77280,3.4,bachelor,25,"Written Comprehension, Oral Expression, Oral Comprehension, Written Expression, Speech Clarity, Deductive Reasoning, Inductive Reasoning","English Language, Education and Training, Customer and Personal Service, Psychology, Administration and Management, Mathematics, Computers and Electronics","Training and Teaching Others, Getting Information, Updating and Using Relevant Knowledge, Organizing, Planning, and Prioritizing Work, Identifying Objects, Actions, and Events, Working with Computers, Communicating with Supervisors, Peers, or Subordinates","Social, Investigative, Conventional, Artistic, Realistic, Enterprising",5
17-3023.00,Electrical and Electronic Engineering Technologists and Technicians,"Critical Thinking, Reading Comprehension, Complex Problem Solving, Active Listening, Troubleshooting, Speaking, Mathematics",77180,0.6,bachelor,17,"Problem Sensitivity, Near Vision, Deductive Reasoning, Written Comprehension, Inductive Reasoning, Oral Comprehension, Oral Expression","Computers and Electronics, Engineering and Technology, English Language, Design, Mathematics, Customer and Personal Service, Mechanical","Working with Computers, Making Decisions and Solving Problems, Getting Information, Communicating with Supervisors, Peers, or Subordinates, Evaluating Information to Determine Compliance with Standards, Updating and Using Relevant Knowledge, Documenting/Recording Information","Realistic, Investigative, Conventional, Social, Artistic, Enterprising",3
13-1051.00,Cost Estimators,"Reading Comprehension, Mathematics, Speaking, Active Listening, Critical Thinking, Judgment and Decision Making, Writing",77070,-4.2,bachelor,13,"Inductive Reasoning, Oral Comprehension, Oral Expression, Mathematical Reasoning, Written Comprehension, Number Facility, Written Expression","Mathematics, Economics and Accounting, Computers and Electronics, Engineering and Technology, Building and Construction, Administration and Management, English Language","Getting Information, Analyzing Data or Information, Working with Computers, Estimating the Quantifiable Characteristics of Products, Events, or Information, Making Decisions and Solving Problems, Communicating with Supervisors, Peers, or Subordinates, Updating and Using Relevant Knowledge","Conventional, Enterprising, Investigative, Realistic, Social, Artistic",4
13-1141.00,"Compensation, Benefits, and Job Analysis Specialists","Reading Comprehension, Critical Thinking, Active Listening, Speaking, Writing, Active Learning, Complex Problem Solving",77020,5.3,bachelor,13,"Oral Expression, Oral Comprehension, Written Comprehension, Deductive Reasoning, Speech Clarity, Problem Sensitivity, Inductive Reasoning","Personnel and Human Resources, Administration and Management, English Language, Mathematics, Customer and Personal Service, Law and Government, Economics and Accounting","Analyzing Data or Information, Getting Information, Working with Computers, Communicating with Supervisors, Peers, or Subordinates, Making Decisions and Solving Problems, Processing Information, Organizing, Planning, and Prioritizing Work","Conventional, Enterprising, Investigative, Social, Realistic, Artistic",4
25-1124.00,"Foreign Language and Literature Teachers, Postsecondary","Speaking, Reading Comprehension, Active Listening, Writing, Learning Strategies, Instructing, Active Learning",77010,-0.2,bachelor,25,"Speech Clarity, Oral Expression, Oral Comprehension, Written Comprehension, Written Expression, Speech Recognition, Inductive Reasoning","Foreign Language, English Language, Education and Training, History and Archeology, Philosophy and Theology, Sociology and Anthropology, Administrative","Training and Teaching Others, Thinking Creatively, Working with Computers, Updating and Using Relevant Knowledge, Getting Information, Organizing, Planning, and Prioritizing Work, Interpreting the Meaning of Information for Others","Social, Investigative, Artistic, Conventional, Enterprising, Realistic",5
13-1161.00,Market Research Analysts and Marketing Specialists,"Reading Comprehension, Writing, Critical Thinking, Active Listening, Speaking, Complex Problem Solving, Judgment and Decision Making",76950,6.7,bachelor,13,"Inductive Reasoning, Oral Comprehension, Written Comprehension, Oral Expression, Written Expression, Fluency of Ideas, Deductive Reasoning","English Language, Customer and Personal Service, Sales and Marketing, Mathematics, Administration and Management, Communications and Media, Administrative","Getting Information, Analyzing Data or Information, Interpreting the Meaning of Information for Others, Processing Information, Working with Computers, Making Decisions and Solving Problems, Organizing, Planning, and Prioritizing Work","Enterprising, Conventional, Investigative, Artistic, Social, Realistic",4
11-9171.00,Funeral Home Managers,"Service Orientation, Active Listening, Speaking, Social Perceptiveness, Reading Comprehension, Monitoring, Time Management",76830,4.1,bachelor,11,"Oral Comprehension, Oral Expression, Written Comprehension, Written Expression, Problem Sensitivity, Speech Clarity, Near Vision","Customer and Personal Service, Administration and Management, English Language, Administrative, Computers and Electronics, Psychology, Education and Training","Assisting and Caring for Others, Performing for or Working Directly with the Public, Getting Information, Communicating with People Outside the Organization, Documenting/Recording Information, Coordinating the Work and Activities of Others, Working with Computers","Enterprising, Conventional, Social, Realistic, Investigative, Artistic",3
13-1031.00,"Claims Adjusters, Examiners, and Investigators","Reading Comprehension, Active Listening, Critical Thinking, Speaking, Judgment and Decision Making, Writing, Complex Problem Solving",76790,-5.1,bachelor,13,"Written Comprehension, Oral Comprehension, Oral Expression, Deductive Reasoning, Inductive Reasoning, Written Expression, Near Vision","Customer and Personal Service, English Language, Administrative, Mathematics, Computers and Electronics, Law and Government, Administration and Management","Working with Computers, Communicating with People Outside the Organization, Getting Information, Identifying Objects, Actions, and Events, Making Decisions and Solving Problems, Communicating with Supervisors, Peers, or Subordinates, Documenting/Recording Information","Conventional, Enterprising, Investigative, Social, Realistic, Artistic",4
13-1032.00,"Insurance Appraisers, Auto Damage","Writing, Speaking, Reading Comprehension, Active Listening, Critical Thinking, Time Management, Judgment and Decision Making",76650,-8.2,bachelor,13,"Oral Comprehension, Oral Expression, Written Comprehension, Problem Sensitivity, Written Expression, Speech Recognition, Speech Clarity","Customer and Personal Service, English Language, Computers and Electronics, Mechanical, Administrative, Education and Training, Law and Government","Working with Computers, Making Decisions and Solving Problems, Documenting/Recording Information, Resolving Conflicts and Negotiating with Others, Performing for or Working Directly with the Public, Communicating with Supervisors, Peers, or Subordinates, Communicating with People Outside the Organization","Conventional, Realistic, Enterprising, Investigative, Social, Artistic",3
47-5043.00,"Roof Bolters, Mining","Operation and Control, Critical Thinking, Monitoring, Operations Monitoring, Troubleshooting, Active Listening, Equipment Maintenance",76640,-34.2,bachelor,47,"Control Precision, Arm-Hand Steadiness, Manual Dexterity, Extent Flexibility, Problem Sensitivity, Multilimb Coordination, Reaction Time","Production and Processing, Education and Training, Mechanical, Public Safety and Security, Administration and Management, Law and Government, English Language","Inspecting Equipment, Structures, or Materials, Operating Vehicles, Mechanized Devices, or Equipment, Controlling Machines and Processes, Monitoring Processes, Materials, or Surroundings, Identifying Objects, Actions, and Events, Repairing and Maintaining Mechanical Equipment, Handling and Moving Objects","Realistic, Conventional, Investigative, Enterprising, Artistic, Social",2
33-1011.00,First-Line Supervisors of Correctional Officers,"Active Listening, Critical Thinking, Monitoring, Social Perceptiveness, Coordination, Speaking, Reading Comprehension",76310,-2.8,bachelor,33,"Oral Comprehension, Oral Expression, Problem Sensitivity, Deductive Reasoning, Written Comprehension, Written Expression, Inductive Reasoning","Public Safety and Security, Law and Government, Administration and Management, Psychology, English Language, Administrative, Computers and Electronics","Documenting/Recording Information, Communicating with Supervisors, Peers, or Subordinates, Resolving Conflicts and Negotiating with Others, Getting Information, Evaluating Information to Determine Compliance with Standards, Making Decisions and Solving Problems, Training and Teaching Others","Enterprising, Conventional, Social, Realistic, Investigative, Artistic",3
33-3051.00,Police and Sheriff's Patrol Officers,"Active Listening, Speaking, Social Perceptiveness, Critical Thinking, Active Learning, Reading Comprehension, Coordination",76290,3.1,bachelor,33,"Oral Comprehension, Problem Sensitivity, Deductive Reasoning, Inductive Reasoning, Oral Expression, Written Comprehension, Speech Clarity","Public Safety and Security, Law and Government, English Language, Psychology, Customer and Personal Service, Education and Training, Telecommunications","Performing for or Working Directly with the Public, Getting Information, Resolving Conflicts and Negotiating with Others, Making Decisions and Solving Problems, Identifying Objects, Actions, and Events, Communicating with Supervisors, Peers, or Subordinates, Operating Vehicles, Mechanized Devices, or Equipment","Realistic, Conventional, Enterprising, Social, Investigative, Artistic",3
