id,title,skills,median_salary,growth_pct,education,sector,abilities,knowledge,work_activities,interests,job_zone
49-9045.00,"Refractory Materials Repairers, Except Brickmasons","Operations Monitoring, Repairing, Active Listening, Operation and Control, Equipment Maintenance, Reading Comprehension, Critical Thinking",58540,-16.9,bachelor,49,"Arm-Hand Steadiness, Extent Flexibility, Near Vision, Oral Comprehension, Manual Dexterity, Control Precision, Multilimb Coordination","Mechanical, Production and Processing, Public Safety and Security, English Language, Mathematics, Chemistry, Design","Handling and Moving Objects, Performing General Physical Activities, Identifying Objects, Actions, and Events, Making Decisions and Solving Problems, Operating Vehicles, Mechanized Devices, or Equipment, Getting Information, Inspecting Equipment, Structures, or Materials","Realistic, Conventional, Investigative, Artistic, Social, Enterprising",2
53-6011.00,Bridge and Lock Tenders,"Monitoring, Active Listening, Speaking, Critical Thinking, Coordination, Operations Monitoring, Operation and Control",58490,-3.3,bachelor,53,"Information Ordering, Near Vision, Selective Attention, Control Precision, Far Vision, Auditory Attention, Oral Comprehension","Public Safety and Security, English Language, Telecommunications, Education and Training, Transportation, Customer and Personal Service, Administrative","Controlling Machines and Processes, Communicating with Supervisors, Peers, or Subordinates, Documenting/Recording Information, Getting Information, Training and Teaching Others, Inspecting Equipment, Structures, or Materials, Monitoring Processes, Materials, or Surroundings","Realistic, Conventional, Enterprising, Investigative, Social, Artistic",2
53-6041.00,Traffic Technicians,"Active Listening, Reading Comprehension, Speaking, Critical Thinking, Complex Problem Solving, Judgment and Decision Making, Writing",58480,3.7,bachelor,53,"Oral Comprehension, Oral Expression, Problem Sensitivity, Inductive Reasoning, Written Comprehension, Deductive Reasoning, Speech Recognition","Public Safety and Security, Computers and Electronics, Transportation, English Language, Engineering and Technology, Law and Government, Mathematics","Getting Information, Working with Computers, Making Decisions and Solving Problems, Processing Information, Communicating with Supervisors, Peers, or Subordinates, Documenting/Recording Information, Identifying Objects, Actions, and Events","Realistic, Conventional, Investigative, Social, Enterprising, Artistic",3
19-5012.00,Occupational Health and Safety Technicians,"Active Listening, Reading Comprehension, Speaking, Critical Thinking, Writing, Monitoring, Complex Problem Solving",58440,8.5,bachelor,19,"Oral Expression, Problem Sensitivity, Deductive Reasoning, Inductive Reasoning, Oral Comprehension, Written Comprehension, Written Expression","Education and Training, English Language, Customer and Personal Service, Public Safety and Security, Chemistry, Law and Government, Engineering and Technology","Evaluating Information to Determine Compliance with Standards, Getting Information, Documenting/Recording Information, Making Decisions and Solving Problems, Communicating with Supervisors, Peers, or Subordinates, Processing Information, Updating and Using Relevant Knowledge","Realistic, Conventional, Investigative, Social, Enterprising, Artistic",3
51-8031.00,Water and Wastewater Treatment Plant and System Operators,"Operations Monitoring, Operation and Control, Monitoring, Active Listening, Quality Control Analysis, Speaking, Critical Thinking",58260,-6.5,bachelor,51,"Oral Comprehension, Oral Expression, Written Comprehension, Near Vision, Deductive Reasoning, Problem Sensitivity, Perceptual Speed","Chemistry, Biology, Mechanical, Mathematics, Public Safety and Security, Production and Processing, Engineering and Technology","Evaluating Information to Determine Compliance with Standards, Controlling Machines and Processes, Monitoring Processes, Materials, or Surroundings, Processing Information, Making Decisions and Solving Problems, Identifying Objects, Actions, and Events, Inspecting Equipment, Structures, or Materials","Realistic, Conventional, Investigative, Social, Enterprising, Artistic",3
29-1128.00,Exercise Physiologists,"Reading Comprehension, Active Listening, Speaking, Critical Thinking, Instructing, Writing, Monitoring",58160,9.5,bachelor,29,"Oral Expression, Problem Sensitivity, Oral Comprehension, Written Comprehension, Deductive Reasoning, Inductive Reasoning, Speech Recognition","Customer and Personal Service, Medicine and Dentistry, Therapy and Counseling, Education and Training, English Language, Biology, Psychology","Assisting and Caring for Others, Getting Information, Establishing and Maintaining Interpersonal Relationships, Interpreting the Meaning of Information for Others, Updating and Using Relevant Knowledge, Performing General Physical Activities, Documenting/Recording Information","Realistic, Investigative, Social, Conventional, Enterprising, Artistic",4
47-2081.00,Drywall and Ceiling Tile Installers,"Critical Thinking, Speaking, Monitoring, Coordination, Judgment and Decision Making, Time Management, Reading Comprehension",58140,4.2,bachelor,47,"Arm-Hand Steadiness, Manual Dexterity, Trunk Strength, Extent Flexibility, Near Vision, Gross Body Equilibrium, Oral Expression","Building and Construction, Mathematics, Mechanical, Public Safety and Security, Administration and Management, Design, English Language","Handling and Moving Objects, Getting Information, Performing General Physical Activities, Inspecting Equipment, Structures, or Materials, Communicating with Supervisors, Peers, or Subordinates, Organizing, Planning, and Prioritizing Work, Coordinating the Work and Activities of Others","Realistic, Conventional, Artistic, Investigative, Social, Enterprising",2
25-9021.00,Farm and Home Management Educators,"Active Listening, Speaking, Reading Comprehension, Writing, Social Perceptiveness, Instructing, Judgment and Decision Making",58120,-2.5,bachelor,25,"Oral Expression, Oral Comprehension, Written Comprehension, Speech Clarity, Written Expression, Deductive Reasoning, Inductive Reasoning","Education and Training, English Language, Food Production, Customer and Personal Service, Biology, Communications and Media, Administration and Management","Communicating with People Outside the Organization, Updating and Using Relevant Knowledge, Establishing and Maintaining Interpersonal Relationships, Performing for or Working Directly with the Public, Training and Teaching Others, Communicating with Supervisors, Peers, or Subordinates, Organizing, Planning, and Prioritizing Work","Social, Investigative, Realistic, Enterprising, Conventional, Artistic",5
53-7121.00,"Tank Car, Truck, and Ship Loaders","Operations Monitoring, Operation and Control, Reading Comprehension, Time Management, Active Listening, Writing, Speaking",58070,4.3,bachelor,53,"Control Precision, Multilimb Coordination, Manual Dexterity, Rate Control, Far Vision, Problem Sensitivity, Perceptual Speed","Transportation, Production and Processing, English Language, Public Safety and Security, Mechanical, Education and Training, Computers and Electronics","Monitoring Processes, Materials, or Surroundings, Inspecting Equipment, Structures, or Materials, Getting Information, Processing Information, Communicating with Supervisors, Peers, or Subordinates, Making Decisions and Solving Problems, Documenting/Recording Information","Realistic, Conventional, Investigative, Enterprising, Artistic, Social",2
19-4061.00,Social Science Research Assistants,"Reading Comprehension, Active Listening, Writing, Critical Thinking, Speaking, Complex Problem Solving, Science",58040,4.4,bachelor,19,"Oral Comprehension, Written Comprehension, Oral Expression, Written Expression, Information Ordering, Deductive Reasoning, Near Vision","English Language, Computers and Electronics, Administrative, Mathematics, Customer and Personal Service, Education and Training, Psychology","Working with Computers, Processing Information, Analyzing Data or Information, Communicating with Supervisors, Peers, or Subordinates, Getting Information, Documenting/Recording Information, Interpreting the Meaning of Information for Others","Investigative, Conventional, Social, Realistic, Enterprising, Artistic",4
53-4013.00,"Rail Yard Engineers, Dinkey Operators, and Hostlers","Operation and Control, Monitoring, Operations Monitoring, Speaking, Active Listening, Complex Problem Solving, Critical Thinking",58030,0.3,bachelor,53,"Oral Comprehension, Problem Sensitivity, Far Vision, Control Precision, Reaction Time, Oral Expression, Response Orientation","Transportation, Public Safety and Security, Administration and Management, Mechanical, English Language, Customer and Personal Service, Education and Training","Operating Vehicles, Mechanized Devices, or Equipment, Getting Information, Inspecting Equipment, Structures, or Materials, Controlling Machines and Processes, Evaluating Information to Determine Compliance with Standards, Identifying Objects, Actions, and Events, Making Decisions and Solving Problems","Realistic, Conventional, Investigative, Enterprising, Social, Artistic",2
47-5013.00,"Service Unit Operators, Oil and Gas","Operations Monitoring, Critical Thinking, Operation and Control, Monitoring, Active Listening, Troubleshooting, Judgment and Decision Making",57980,0.4,bachelor,47,"Problem Sensitivity, Arm-Hand Steadiness, Control Precision, Multilimb Coordination, Near Vision, Reaction Time, Hearing Sensitivity","Mechanical, Mathematics, Customer and Personal Service, Engineering and Technology, Public Safety and Security, Education and Training, English Language","Controlling Machines and Processes, Inspecting Equipment, Structures, or Materials, Communicating with Supervisors, Peers, or Subordinates, Coordinating the Work and Activities of Others, Monitoring Processes, Materials, or Surroundings, Training and Teaching Others, Establishing and Maintaining Interpersonal Relationships","Realistic, Conventional, Investigative, Enterprising, Social, Artistic",2
33-3012.00,Correctional Officers and Jailers,"Active Listening, Monitoring, Social Perceptiveness, Speaking, Critical Thinking, Reading Comprehension, Coordination",57970,-7.8,bachelor,33,"Oral Comprehension, Oral Expression, Problem Sensitivity, Deductive Reasoning, Inductive Reasoning, Speech Clarity, Near Vision","Public Safety and Security, English Language, Law and Government, Customer and Personal Service, Administration and Management, Computers and Electronics, Psychology","Making Decisions and Solving Problems, Communicating with Supervisors, Peers, or Subordinates, Resolving Conflicts and Negotiating with Others, Documenting/Recording Information, Getting Information, Training and Teaching Others, Organizing, Planning, and Prioritizing Work","Realistic, Conventional, Social, Enterprising, Investigative, Artistic",2
31-9011.00,Massage Therapists,"Active Listening, Speaking, Social Perceptiveness, Service Orientation, Judgment and Decision Making, Reading Comprehension, Writing",57950,15.4,bachelor,31,"Dynamic Strength, Trunk Strength, Oral Comprehension, Oral Expression, Manual Dexterity, Problem Sensitivity, Multilimb Coordination","Customer and Personal Service, Biology, English Language, Psychology, Medicine and Dentistry, Sales and Marketing, Public Safety and Security","Assisting and Caring for Others, Performing for or Working Directly with the Public, Performing General Physical Activities, Establishing and Maintaining Interpersonal Relationships, Getting Information, Making Decisions and Solving Problems, Evaluating Information to Determine Compliance with Standards","Social, Realistic, Investigative, Conventional, Artistic, Enterprising",3
19-4031.00,Chemical Technicians,"Science, Reading Comprehension, Critical Thinking, Active Listening, Writing, Monitoring, Speaking",57790,3.7,bachelor,19,"Written Comprehension, Near Vision, Written Expression, Oral Comprehension, Problem Sensitivity, Inductive Reasoning, Information Ordering","Chemistry, English Language, Mathematics, Computers and Electronics, Production and Processing, Administrative, Education and Training","Documenting/Recording Information, Monitoring Processes, Materials, or Surroundings, Processing Information, Making Decisions and Solving Problems, Inspecting Equipment, Structures, or Materials, Organizing, Planning, and Prioritizing Work, Communicating with Supervisors, Peers, or Subordinates","Investigative, Realistic, Conventional, Social, Artistic, Enterprising",3
43-5061.00,"Production, Planning, and Expediting Clerks","Reading Comprehension, Speaking, Active Listening, Time Management, Critical Thinking, Writing, Monitoring",57770,-1.8,bachelor,43,"Oral Comprehension, Information Ordering, Oral Expression, Problem Sensitivity, Written Comprehension, Near Vision, Written Expression","Production and Processing, Customer and Personal Service, English Language, Administrative, Administration and Management, Computers and Electronics, Mathematics","Working with Computers, Communicating with Supervisors, Peers, or Subordinates, Getting Information, Processing Information, Monitoring Processes, Materials, or Surroundings, Identifying Objects, Actions, and Events, Making Decisions and Solving Problems","Conventional, Enterprising, Realistic, Social, Investigative, Artistic",2
43-5052.00,Postal Service Mail Carriers,"Active Listening, Speaking, Critical Thinking, Social Perceptiveness, Time Management, Coordination, Reading Comprehension",57490,-3.5,bachelor,43,"Information Ordering, Near Vision, Oral Comprehension, Written Comprehension, Problem Sensitivity, Category Flexibility, Arm-Hand Steadiness","Customer and Personal Service, English Language, Public Safety and Security, Sales and Marketing, Transportation, Administration and Management, Production and Processing","Operating Vehicles, Mechanized Devices, or Equipment, Performing General Physical Activities, Handling and Moving Objects, Getting Information, Performing for or Working Directly with the Public, Communicating with People Outside the Organization, Establishing and Maintaining Interpersonal Relationships","Conventional, Realistic, Enterprising, Social, Investigative, Artistic",2
53-3052.00,"Bus Drivers, Transit and Intercity","Operation and Control, Operations Monitoring, Active Listening, Critical Thinking, Service Orientation, Time Management, Speaking",57440,4.3,bachelor,53,"Far Vision, Control Precision, Multilimb Coordination, Depth Perception, Spatial Orientation, Response Orientation, Reaction Time","Transportation, Customer and Personal Service, Public Safety and Security, English Language, Law and Government, Administration and Management, Telecommunications","Operating Vehicles, Mechanized Devices, or Equipment, Performing for or Working Directly with the Public, Inspecting Equipment, Structures, or Materials, Communicating with Supervisors, Peers, or Subordinates, Getting Information, Making Decisions and Solving Problems, Identifying Objects, Actions, and Events","Realistic, Conventional, Social, Enterprising, Investigative, Artistic",2
53-3032.00,Heavy and Tractor-Trailer Truck Drivers,"Operations Monitoring, Operation and Control, Monitoring, Reading Comprehension, Speaking, Critical Thinking, Troubleshooting",57440,4.0,bachelor,53,"Far Vision, Spatial Orientation, Control Precision, Multilimb Coordination, Response Orientation, Rate Control, Reaction Time","Transportation, Public Safety and Security, Customer and Personal Service, English Language, Law and Government, Mechanical, Telecommunications","Operating Vehicles, Mechanized Devices, or Equipment, Inspecting Equipment, Structures, or Materials, Getting Information, Monitoring Processes, Materials, or Surroundings, Identifying Objects, Actions, and Events, Communicating with Supervisors, Peers, or Subordinates, Evaluating Information to Determine Compliance with Standards","Realistic, Conventional, Investigative, Enterprising, Social, Artistic",2
47-2053.00,Terrazzo Workers and Finishers,"Coordination, Quality Control Analysis, Speaking, Judgment and Decision Making, Monitoring, Operations Monitoring, Operation and Control",57260,-11.1,bachelor,47,"Manual Dexterity, Multilimb Coordination, Trunk Strength, Near Vision, Arm-Hand Steadiness, Finger Dexterity, Extent Flexibility","Building and Construction, Design, Mathematics, English Language, Administration and Management, Customer and Personal Service, Chemistry","Performing General Physical Activities, Getting Information, Handling and Moving Objects, Controlling Machines and Processes, Inspecting Equipment, Structures, or Materials, Monitoring Processes, Materials, or Surroundings, Communicating with Supervisors, Peers, or Subordinates","Realistic, Conventional, Investigative, Artistic, Social, Enterprising",2
47-2132.00,"Insulation Workers, Mechanical","Active Listening, Critical Thinking, Monitoring, Coordination, Time Management, Speaking, Judgment and Decision Making",57250,4.7,bachelor,47,"Trunk Strength, Problem Sensitivity, Extent Flexibility, Oral Comprehension, Oral Expression, Information Ordering, Selective Attention","Building and Construction, Customer and Personal Service, Mechanical, Administration and Management, Education and Training, Mathematics, Production and Processing","Handling and Moving Objects, Performing General Physical Activities, Monitoring Processes, Materials, or Surroundings, Communicating with Supervisors, Peers, or Subordinates, Making Decisions and Solving Problems, Inspecting Equipment, Structures, or Materials, Organizing, Planning, and Prioritizing Work","Realistic, Conventional, Investigative, Social, Artistic, Enterprising",2
51-9011.00,Chemical Equipment Operators and Tenders,"Operations Monitoring, Operation and Control, Monitoring, Reading Comprehension, Active Listening, Critical Thinking, Judgment and Decision Making",57090,3.3,bachelor,51,"Oral Comprehension, Oral Expression, Problem Sensitivity, Control Precision, Near Vision, Written Comprehension, Perceptual Speed","Production and Processing, Chemistry, Mechanical, Computers and Electronics, English Language, Mathematics, Public Safety and Security","Monitoring Processes, Materials, or Surroundings, Getting Information, Making Decisions and Solving Problems, Inspecting Equipment, Structures, or Materials, Controlling Machines and Processes, Communicating with Supervisors, Peers, or Subordinates, Identifying Objects, Actions, and Events","Realistic, Conventional, Investigative, Enterprising, Social, Artistic",2
33-3011.00,Bailiffs,"Social Perceptiveness, Speaking, Monitoring, Active Listening, Judgment and Decision Making, Critical Thinking, Time Management",57050,-2.2,bachelor,33,"Problem Sensitivity, Oral Expression, Selective Attention, Speech Clarity, Oral Comprehension, Speech Recognition, Near Vision","Public Safety and Security, Law and Government, English Language, Customer and Personal Service, Psychology, Administration and Management, Education and Training","Resolving Conflicts and Negotiating with Others, Communicating with Supervisors, Peers, or Subordinates, Making Decisions and Solving Problems, Monitoring Processes, Materials, or Surroundings, Updating and Using Relevant Knowledge, Identifying Objects, Actions, and Events, Performing for or Working Directly with the Public","Realistic, Conventional, Enterprising, Social, Investigative, Artistic",3
53-2022.00,Airfield Operations Specialists,"Active Listening, Monitoring, Reading Comprehension, Speaking, Critical Thinking, Coordination, Writing",56750,4.2,bachelor,53,"Problem Sensitivity, Deductive Reasoning, Oral Comprehension, Written Comprehension, Oral Expression, Inductive Reasoning, Speech Clarity","Public Safety and Security, Transportation, English Language, Customer and Personal Service, Education and Training, Telecommunications, Administration and Management","Inspecting Equipment, Structures, or Materials, Operating Vehicles, Mechanized Devices, or Equipment, Evaluating Information to Determine Compliance with Standards, Identifying Objects, Actions, and Events, Communicating with Supervisors, Peers, or Subordinates, Getting Information, Documenting/Recording Information","Conventional, Realistic, Enterprising, Investigative, Social, Artistic",3
43-5053.00,"Postal Service Mail Sorters, Processors, and Processing Machine Operators","Monitoring, Reading Comprehension, Speaking, Critical Thinking, Coordination, Active Listening, Operations Monitoring",56530,-8.4,bachelor,43,"Near Vision, Manual Dexterity, Written Comprehension, Information Ordering, Category Flexibility, Perceptual Speed, Multilimb Coordination","English Language, Production and Processing, Customer and Personal Service, Administrative, Administration and Management, Public Safety and Security, Transportation","Performing General Physical Activities, Handling and Moving Objects, Communicating with Supervisors, Peers, or Subordinates, Getting Information, Establishing and Maintaining Interpersonal Relationships, Identifying Objects, Actions, and Events, Processing Information","Conventional, Realistic, Social, Enterprising, Investigative, Artistic",2
41-9022.00,Real Estate Sales Agents,"Active Listening, Speaking, Negotiation, Social Perceptiveness, Coordination, Critical Thinking, Persuasion",56320,3.1,bachelor,41,"Oral Comprehension, Oral Expression, Written Comprehension, Speech Recognition, Speech Clarity, Written Expression, Deductive Reasoning","Customer and Personal Service, Sales and Marketing, English Language, Law and Government, Administrative, Administration and Management, Computers and Electronics","Resolving Conflicts and Negotiating with Others, Working with Computers, Establishing and Maintaining Interpersonal Relationships, Making Decisions and Solving Problems, Getting Information, Organizing, Planning, and Prioritizing Work, Communicating with People Outside the Organization","Enterprising, Conventional, Social, Realistic, Artistic, Investigative",3
39-4011.00,Embalmers,"Speaking, Active Listening, Writing, Critical Thinking, Social Perceptiveness, Service Orientation, Time Management",56280,1.3,bachelor,39,"Near Vision, Oral Comprehension, Problem Sensitivity, Oral Expression, Arm-Hand Steadiness, Speech Recognition, Deductive Reasoning","Customer and Personal Service, Chemistry, Psychology, English Language, Law and Government, Biology, Administration and Management","Assisting and Caring for Others, Documenting/Recording Information, Making Decisions and Solving Problems, Handling and Moving Objects, Getting Information, Evaluating Information to Determine Compliance with Standards, Updating and Using Relevant Knowledge","Realistic, Conventional, Social, Enterprising, Investigative, Artistic",3
11-9031.00,"Education and Childcare Administrators, Preschool and Daycare","Reading Comprehension, Active Listening, Speaking, Critical Thinking, Monitoring, Coordination, Social Perceptiveness",56270,-2.5,bachelor,11,"Written Expression, Oral Comprehension, Written Comprehension, Oral Expression, Deductive Reasoning, Problem Sensitivity, Inductive Reasoning","Customer and Personal Service, Education and Training, Administration and Management, English Language, Psychology, Public Safety and Security, Personnel and Human Resources","Training and Teaching Others, Establishing and Maintaining Interpersonal Relationships, Communicating with Supervisors, Peers, or Subordinates, Assisting and Caring for Others, Evaluating Information to Determine Compliance with Standards, Communicating with People Outside the Organization, Performing for or Working Directly with the Public","Social, Enterprising, Conventional, Investigative, Artistic, Realistic",4
37-1012.00,"First-Line Supervisors of Landscaping, Lawn Service, and Groundskeeping Workers","Monitoring, Time Management, Active Listening, Management of Personnel Resources, Speaking, Critical Thinking, Coordination",56170,2.3,bachelor,37,"Oral Comprehension, Oral Expression, Problem Sensitivity, Near Vision, Written Comprehension, Visualization, Speech Recognition","Customer and Personal Service, English Language, Administration and Management, Mathematics, Public Safety and Security, Personnel and Human Resources, Mechanical","Scheduling Work and Activities, Coordinating the Work and Activities of Others, Making Decisions and Solving Problems, Operating Vehicles, Mechanized Devices, or Equipment, Communicating with Supervisors, Peers, or Subordinates, Getting Information, Evaluating Information to Determine Compliance with Standards","Enterprising, Conventional, Realistic, Social, Investigative, Artistic",3
51-4041.00,Machinists,"Operation and Control, Critical Thinking, Monitoring, Operations Monitoring, Active Listening, Speaking, Coordination",56150,0.0,bachelor,51,"Arm-Hand Steadiness, Manual Dexterity, Finger Dexterity, Control Precision, Problem Sensitivity, Deductive Reasoning, Selective Attention","Mathematics, Mechanical, Production and Processing, Design, Engineering and Technology, English Language, Customer and Personal Service","Controlling Machines and Processes, Getting Information, Inspecting Equipment, Structures, or Materials, Monitoring Processes, Materials, or Surroundings, Identifying Objects, Actions, and Events, Repairing and Maintaining Mechanical Equipment, Making Decisions and Solving Problems","Realistic, Conventional, Investigative, Artistic, Enterprising, Social",3
